name,description,head_of_department,location,directions
Cardiology,Handles heart-related treatments,Dr. Kiran Kumar,First Floor,Take elevator and turn right
Neurology,Specializes in brain and nervous system,Dr. Ritu Sharma,Second Floor,Take lift to 2nd floor and turn left
Orthopedics,Bone and joint care,Dr. Arjun Patel,Ground Floor,Next to Radiology
Pediatrics,Child health and vaccination,Dr. Meera Rao,Third Floor,Near Child Ward
Dermatology,Skin and hair care,Dr. Rajesh Nair,Fourth Floor,Opposite Pharmacy
